{
  "environment": {
    "class": "INTEGRATION",
    "id": "integration"
  },
  "finished_at": "2026-10-28T14:38:01+00:00",
  "host_source": {
    "checked_out_commit": "e1752d90febabc5db09ba61fd6380a2951462bf6",
    "manual_patches": 0,
    "release_commit": "e1752d90febabc5db09ba61fd6380a2951462bf6"
  },
  "manifest_sha256": "e8944957755bcb761753902af8caa1e5ce1ce995230f25e9f300aecd6864a01c",
  "previous_release_id": null,
  "record_id": "DEP-REC-20261028T143759Z-91924798",
  "release_id": "REL-e1752d90feba-40707535295",
  "result": "FAILED",
  "rollback": null,
  "schema": "cap.deployment-record/v1",
  "stages": [
    {
      "detail": "ci-gate at the release commit is missing, not success; digest not found in the registry: ['ghcr.io/asperant/cap-mlflow@sha256:0000000000000000000000000000000000000000000000000000000000000000']",
      "finished_at": "2026-10-28T14:38:01+00:00",
      "result": "FAILED",
      "stage": "preflight",
      "started_at": "2026-10-28T14:37:59+00:00"
    },
    {
      "detail": "preflight failed; nothing was rolled out",
      "finished_at": null,
      "result": "NOT_RUN",
      "stage": "migrate",
      "started_at": null
    },
    {
      "detail": "preflight failed; nothing was rolled out",
      "finished_at": null,
      "result": "NOT_RUN",
      "stage": "rollout",
      "started_at": null
    },
    {
      "detail": "preflight failed; nothing was rolled out",
      "finished_at": null,
      "result": "NOT_RUN",
      "stage": "health",
      "started_at": null
    },
    {
      "detail": "preflight failed; nothing was rolled out",
      "finished_at": null,
      "result": "NOT_RUN",
      "stage": "smoke",
      "started_at": null
    }
  ],
  "started_at": "2026-10-28T14:37:59+00:00",
  "supply_chain_verification": {
    "ci_gate": "missing",
    "digests_in_registry": false,
    "main_derived": true,
    "tags_trusted": false
  }
}
