{
  "environment": {
    "class": "INTEGRATION",
    "id": "integration"
  },
  "finished_at": "2026-10-28T14:49:35+00:00",
  "host_source": {
    "checked_out_commit": "e1752d90febabc5db09ba61fd6380a2951462bf6",
    "manual_patches": 0,
    "release_commit": "e1752d90febabc5db09ba61fd6380a2951462bf6"
  },
  "manifest_sha256": "240547325abd5b86b1f4b4116e3baafaaf5d100f41e8fbdfeb17dfd81aa6d463",
  "previous_release_id": null,
  "record_id": "DEP-REC-20261028T144110Z-304dd53c",
  "release_id": "REL-e1752d90feba-40707535295",
  "result": "FAILED",
  "rollback": null,
  "schema": "cap.deployment-record/v1",
  "stages": [
    {
      "detail": "main-derived, ci-gate green, digests present, host source clean",
      "finished_at": "2026-10-28T14:41:12+00:00",
      "result": "PASSED",
      "stage": "preflight",
      "started_at": "2026-10-28T14:41:10+00:00"
    },
    {
      "detail": "the release binds no database schema target",
      "finished_at": "2026-10-28T14:41:12+00:00",
      "result": "SKIPPED",
      "stage": "migrate",
      "started_at": "2026-10-28T14:41:12+00:00"
    },
    {
      "detail": "released services started from their digests",
      "finished_at": "2026-10-28T14:49:09+00:00",
      "result": "PASSED",
      "stage": "rollout",
      "started_at": "2026-10-28T14:41:12+00:00"
    },
    {
      "detail": "every service healthy",
      "finished_at": "2026-10-28T14:49:09+00:00",
      "result": "PASSED",
      "stage": "health",
      "started_at": "2026-10-28T14:49:09+00:00"
    },
    {
      "detail": "REAL smoke checks failed: inux-x86_64-gnu/lib/python3.11/socket.py:718: TimeoutError\n----------------- flaky-test quarantine (ci/flaky_tests.yaml) ------------------\n0 registry entr(y/ies); 0 applied in this run\n=========================== short test summary info ============================\nFAILED infra/compose/tests/test_runtime_integration.py::test_qdrant_round_trips_a_vector\n1 failed, 19 passed, 72 deselected in 25.66s",
      "finished_at": "2026-10-28T14:49:35+00:00",
      "result": "FAILED",
      "stage": "smoke",
      "started_at": "2026-10-28T14:49:09+00:00"
    }
  ],
  "started_at": "2026-10-28T14:41:10+00:00",
  "supply_chain_verification": {
    "ci_gate": "success",
    "digests_in_registry": true,
    "main_derived": true,
    "tags_trusted": false
  }
}
