{
  "environment": {
    "class": "INTEGRATION",
    "id": "integration"
  },
  "finished_at": "2026-10-28T13:57:11+00:00",
  "host_source": {
    "checked_out_commit": "2e1428d4954b77993985c1759caff50e67df1cdf",
    "manual_patches": 0,
    "release_commit": "2e1428d4954b77993985c1759caff50e67df1cdf"
  },
  "manifest_sha256": "b6d99609ca49c357620c528d7e62ff20a71cca2c3f5ebc3cc374ec795481398d",
  "previous_release_id": null,
  "record_id": "DEP-REC-20261028T135709Z-ad94c057",
  "release_id": "REL-2e1428d4954b-40696269604",
  "result": "FAILED",
  "rollback": null,
  "schema": "cap.deployment-record/v1",
  "stages": [
    {
      "detail": "digest not found in the registry: ['ghcr.io/asperant/cap-mlflow@sha256:0000000000000000000000000000000000000000000000000000000000000000']",
      "finished_at": "2026-10-28T13:57:11+00:00",
      "result": "FAILED",
      "stage": "preflight",
      "started_at": "2026-10-28T13:57:09+00:00"
    },
    {
      "detail": "preflight failed; nothing was rolled out",
      "finished_at": null,
      "result": "NOT_RUN",
      "stage": "migrate",
      "started_at": null
    },
    {
      "detail": "preflight failed; nothing was rolled out",
      "finished_at": null,
      "result": "NOT_RUN",
      "stage": "rollout",
      "started_at": null
    },
    {
      "detail": "preflight failed; nothing was rolled out",
      "finished_at": null,
      "result": "NOT_RUN",
      "stage": "health",
      "started_at": null
    },
    {
      "detail": "preflight failed; nothing was rolled out",
      "finished_at": null,
      "result": "NOT_RUN",
      "stage": "smoke",
      "started_at": null
    }
  ],
  "started_at": "2026-10-28T13:57:09+00:00",
  "supply_chain_verification": {
    "ci_gate": "success",
    "digests_in_registry": false,
    "main_derived": true,
    "tags_trusted": false
  }
}
